,Unnamed: 0,Recipe_Name,Type,Serving,Protein,Fat,Carbs,Calories,cholesterol,sodium,fiber,sugar,Prepare time,cooking time,Total_Time,Ratings
233,33,Grilled Chicken Sandwich,Dinner,1.0,45.0,11.5,29.5,406.0,124.0,847.5,2.5,7.5,15.0,15.0,4 hrs 30 mins,4.85
234,34,Slow Cooker Pulled Pork,Dinner,3.0,30.5,3.0,12.5,203.0,92.0,593.5,0.5,10.5,5.0,,7 hrs 5 mins,4.94
235,35,Chipotle Chicken,boneless chicken thighs,1.0,34.0,7.0,2.0,216.0,69.0,561.0,0.5,,15.0,15.0,30 mins,5.0
236,36,Protein Bagels with Cottage Cheese,Cottage Cheese,1.0,9.0,1.0,28.5,164.0,5.0,583.0,1.0,1.0,10.0,12.0,37 mins,4.82
237,37,Turkey Burger Recipe,burger,1.0,29.0,12.0,33.5,351.0,84.0,768.5,2.0,8.5,10.0,15.0,25 mins,4.91
238,38,Greek Cottage Cheese Bowl,Cottage Cheese,1.0,21.5,7.0,9.5,186.0,28.5,695.0,1.5,6.0,10.0,0.0,15 mins,4.72
239,39,Chicken Summer Rolls,Appetizer,2.0,23.0,16.0,30.0,299.0,98.0,899.5,2.0,6.0,10.0,30.0,40 mins,4.84
240,40,Blackened Grilled Salmon Skewers,Dinner,2.0,26.5,9.0,10.5,199.0,72.5,352.5,5.0,2.5,20.0,10.0,1 hr 30 mins,5.0
241,41,Greek Tofu Bowls,lunch,1.0,32.0,27.0,30.0,485.0,16.0,682.0,6.0,9.0,20.0,40.0,1 hr,4.67
242,42,Air Fryer Salmon Patties,Dinner,2.0,33.5,14.5,9.5,314.0,225.0,842.0,0.5,1.5,5.0,10.0,25 mins,4.95
243,43,Fiesta Bean Salad,lunch,1.0,14.0,11.5,47.0,335.0,,481.5,15.5,0.5,10.0,0.0,10 mins,4.99
244,44,Open Faced Tuna Sandwich with Avocado,lunch,1.0,18.0,8.0,28.0,247.0,16.0,384.5,6.0,3.0,5.0,2.0,7 mins,5.0
245,45,Artichoke Pie,dessert,1.0,12.5,13.0,17.0,229.0,107.5,401.0,4.0,1.0,10.0,55.0,1 hr 5 mins,4.86
246,46,Italian Sub Broccoli Salad,lunch,2.0,21.0,23.5,20.0,373.0,41.0,1278.0,6.0,8.0,15.0,0.0,15 mins,4.99
247,47,5-Ingredient Salmon Salad (easy lunch idea),Lettuce Wraps,1.0,17.5,7.0,2.5,139.0,39.5,185.0,0.5,1.0,2.0,3.0,15 mins,4.71
248,48,Baked Shrimp Parmesan Hero,Dinner,1.0,29.6,8.0,57.5,433.0,,559.0,2.5,,5.0,25.0,30 mins,4.88
249,49,Tofu Poke Bowl,dinner,1.0,29.0,24.0,47.0,520.0,,956.0,12.0,5.0,10.0,10.0,50 mins,4.74
250,50,Broccoli Cheddar Soup,lunch,1.0,12.5,12.5,24.0,242.0,37.5,360.0,4.0,6.0,20.0,30.0,50 mins,4.99
251,51,Classic Chicken Salad Recipe,lunch,1.0,18.0,5.0,2.0,131.0,50.0,307.0,,1.0,5.0,5.0,10 mins,4.92
252,52,"Honey Sriracha Roasted Salmon Rice Bowls (GF, DF)",rice bowl,1.0,38.5,17.5,48.0,506.0,93.5,489.0,5.0,10.5,20.0,10.0,30 mins,4.92
253,53,"Loaded Nachos with Ground Turkey, Beans and Cheese",appetizer,1.0,28.0,17.5,45.0,386.0,32.0,990.0,1.5,8.5,10.0,15.0,25 mins,4.96
254,54,Air Fryer Egg Salad,lunch,2.0,12.5,20.0,1.0,237.0,378.0,299.5,,0.5,5.0,15.0,20 mins,5.0
255,55,5-Minute Microwave Salmon Rice Bowl with Bok Choy,Rice Bowl,1.0,48.5,18.0,51.0,533.0,93.5,856.0,10.0,19.5,1.0,5.0,6 mins,5.0
256,56,Pasta Fagioli (Pasta and Beans),dinner,1.0,10.0,4.0,46.0,262.5,46.0,623.0,5.5,6.0,10.0,25.0,35 mins,4.94
257,57,Teriyaki Shrimp Quinoa Bowls with Mango-Cucumber Salsa,Quinoa,1.0,24.0,10.0,44.5,352.0,143.0,1389.0,6.5,14.5,10.0,30.0,40 mins,5.0
258,58,Tortilla Encrusted Chicken Tenders,Appetizer,2.0,34.0,11.0,22.0,331.0,137.0,695.0,1.5,2.0,5.0,,25 mins,4.95
259,59,Avgolemono Chicken and Rice Soup,Dinner,1.0,27.5,6.5,21.5,265.0,168.5,413.0,0.5,2.0,10.0,45.0,55 mins,4.94
260,60,Broccoli Salad,burger,1.0,6.5,11.5,11.0,171.0,8.5,279.0,2.0,6.0,5.0,10.0,15 mins,5.0
261,61,Borscht,Dinner,1.0,4.5,5.0,28.0,167.0,,599.5,4.0,10.0,15.0,30.0,45 mins,5.0
262,62,Perfect Air Fryer Shrimp,dinner,8.0,19.5,8.0,2.0,163.0,178.5,873.5,0.5,-1.0,4.0,6.0,10 mins,4.91
263,63,Salmon Caesar Salad,lunch,1.0,42.0,20.0,6.5,364.0,97.5,414.5,3.0,1.5,15.0,15.0,30 mins,4.95
264,64,Spicy Hearts of Palm Noodle Stir Fry with Ground Chicken,lunch,1.0,26.0,12.0,16.5,275.0,98.0,1772.0,5.0,2.5,5.0,15.0,20 mins,4.75
265,65,Buffalo Chicken Rice Bowls,lunch,1.0,49.5,9.5,47.5,485.0,134.0,1200.0,7.0,1.5,15.0,15.0,30 mins,4.86
266,66,Breaded Shrimp,Dinner,1.0,20.0,3.0,10.0,149.0,145.0,934.5,0.5,1.0,15.0,10.0,25 mins,4.86
267,67,"Veggie Stromboli with Mushroom, Spinach and Mozzarella",appetizer,1.0,11.0,6.0,31.5,217.5,7.5,519.5,1.5,3.5,20.0,35.0,55 mins,5.0
268,68,Rainbow Quinoa Salad with Lemon Dressing,Quinoa,2.0,10.5,17.0,51.0,394.0,,184.0,7.0,7.0,15.0,15.0,30 mins,4.62
269,69,Asian Chicken Lettuce Wraps,Lettuce Wraps,1.0,8.5,3.0,9.5,102.0,32.0,344.0,1.0,4.5,10.0,40.0,50 mins,5.0
270,70,Tortilla Soup,Dinner,1.0,17.0,10.0,16.0,246.0,46.0,593.0,3.0,4.0,15.0,25.0,40 mins,4.67
271,71,Chicken Parmesan Rolls,lunch,1.0,27.5,4.5,28.0,259.0,55.5,574.0,1.5,2.5,25.0,20.0,45 mins,4.68
272,72,"Sweet Potato Soup with Sausage (Slow Cooker, Instant Pot, Stove)",Instant Pot,1.0,23.5,8.5,23.0,265.0,66.0,1236.0,4.0,7.0,10.0,,6 hrs 10 mins,4.93
273,73,Blackened Air Fryer Salmon Bites,Dinner,1.0,34.0,11.0,2.0,251.0,93.5,356.5,1.0,0.5,3.0,7.0,10 mins,4.97
274,74,Lemony Hearts of Palm Salad with Avocado,Dinner,1.0,2.5,12.5,8.0,145.0,,166.0,4.0,-1.0,10.0,0.0,10 mins,4.75
275,75,Pizza Sausage Rolls,dinner,1.0,22.0,10.0,30.0,302.0,51.0,957.0,1.5,4.0,20.0,30.0,50 mins,4.91
276,76,Air Fryer Salmon Fish Sandwich,dinner,1.0,33.0,24.0,31.5,493.0,77.5,824.5,3.5,4.0,5.0,10.0,15 mins,4.84
277,77,Chicken Taco Poblano Rice Bowls,dinner,1.0,40.5,12.0,52.0,475.0,116.0,407.5,6.0,3.5,10.0,15.0,25 mins,4.96
278,78,Creamy Sausage and Potato Soup,dinner,1.0,25.0,7.5,60.0,402.0,55.0,1164.0,9.5,8.0,10.0,45.0,55 mins,4.94
279,79,Avocado Toast with Halloumi and Egg,Breakfast,1.0,16.0,17.0,19.0,295.0,211.0,812.0,3.0,2.0,5.0,15.0,20 mins,5.0
280,80,Fish Taco Bowls,quinoa,6.0,31.5,12.5,9.0,264.0,84.0,1084.0,3.0,3.5,5.0,10.0,15 mins,4.87
281,81,"Grilled Chicken Panini with Zucchini, Tomato, and Mozzarella",dinner,1.0,36.0,17.5,33.5,433.0,109.5,899.0,2.0,4.0,10.0,10.0,30 mins,4.91
282,82,Chicken Caprese Skillet,dinner,1.0,47.5,16.5,21.0,419.0,141.0,585.0,2.0,7.0,15.0,20.0,35 mins,4.84
283,83,Three-Cheese Zucchini Quiche,lunch,1.0,15.0,19.0,21.0,307.0,202.0,544.0,1.0,5.0,15.0,,1 hr 30 mins,4.91
284,84,Tuna Tartare,appetizer,1.0,11.0,6.5,2.5,114.0,16.0,342.5,1.5,0.5,10.0,0.0,10 mins,5.0
285,85,BLT Roll Ups with Turkey and Avocado,lunch,1.0,22.0,16.0,29.0,341.0,39.0,806.0,3.5,1.0,5.0,10.0,15 mins,5.0
286,86,Lentil Salad,lunch,1.0,10.0,3.5,29.5,181.0,,251.0,5.5,3.0,15.0,20.0,35 mins,4.96
287,87,Air Fryer Popcorn Chicken,appetizer,15.0,30.0,8.0,21.0,283.0,129.0,385.0,1.5,2.0,30.0,10.0,40 mins,4.94
288,88,Lobster Rolls,Lunch,1.0,22.2,3.1,28.5,223.0,,538.6,4.3,6.4,5.0,10.0,15 mins,4.58
289,89,Corn Tomato Avocado Salad,,1.0,2.5,8.5,14.0,128.0,,83.0,4.0,3.5,5.0,10.0,15 mins,4.98
290,90,Chickpea Milanese,breakfast,1.0,10.0,13.5,41.0,320.0,0.5,428.5,8.5,5.0,15.0,10.0,25 mins,4.37
291,91,Grilled Chicken Chickpea Salad,lunch,1.0,34.0,19.5,41.0,462.0,73.5,1103.0,11.5,16.0,5.0,0.0,5 mins,5.0
292,92,Watermelon Arugula and Feta Salad,Lunch,1.0,4.0,11.5,11.0,157.5,,219.5,1.0,9.0,10.0,0.0,10 mins,5.0
293,93,Chili-Lime Air Fryer Salmon,Dinner,1.0,37.5,12.5,0.5,262.0,109.0,322.5,0.5,,5.0,10.0,15 mins,4.97
294,94,Tuna Poke Salad,Dinner,1.0,36.0,23.0,16.0,404.0,43.0,1211.5,7.5,3.5,15.0,0.0,15 mins,5.0
295,95,Arugula Pasta Salad with Chickpeas and Sun Dried Tomatoes (no mayo),Dinner,2.0,11.0,9.0,43.5,280.0,2.0,337.0,8.0,3.0,5.0,10.0,15 mins,5.0
296,96,Honey Sriracha Chicken and Broccoli Meal Prep Bowls,lunch,1.0,44.0,9.5,41.0,428.0,124.0,570.0,4.0,12.0,10.0,20.0,30 mins,4.69
297,97,Sous Vide Chicken Breast and a Cilantro Lime Chicken Avocado Salad,lunch,1.0,25.0,22.5,7.5,329.0,72.5,364.5,4.0,1.0,30.0,,2 hrs 30 mins,4.58
298,98,"Seared Scallop Salad with Grapefruit, Arugula and Spinach",lunch,1.0,19.0,10.0,16.5,217.0,,,2.9,1.4,10.0,10.0,20 mins,5.0
299,99,Burst Tomato Cottage Cheese Caprese Bowl,Cottage Cheese,1.0,20.5,12.0,13.0,245.0,20.0,469.0,2.0,11.0,2.0,5.0,7 mins,4.93
300,100,Buffalo Chicken Salad,lettuce wraps,1.0,30.0,24.0,4.0,359.0,90.0,1401.5,1.0,2.5,5.0,0.0,5 mins,4.6
301,101,Grilled Vegetable Orzo Pasta Salad,lunch,1.0,6.5,9.0,39.5,267.0,,6.0,4.0,4.5,10.0,15.0,25 mins,4.91
302,102,Lemon Asparagus Couscous Salad with Tomatoes,Asparagus,1.0,6.5,4.0,30.0,170.0,,10.0,5.0,,5.0,,30 mins,4.78
303,103,Slow Cooker Chicken Tacos,dinner,3.0,45.5,13.5,44.5,474.0,124.5,470.5,9.5,4.0,2.0,,4 hrs 2 mins,4.97
304,104,Spicy Canned Salmon Rice Bowl,Rice Bowl,1.0,25.0,14.0,39.0,389.0,65.0,757.0,4.0,4.0,5.0,0.0,5 mins,4.89
305,105,Avocado Quinoa Salad,Quinoa,1.0,11.0,23.0,55.0,443.0,,174.0,16.0,9.5,5.0,20.0,25 mins,4.87
306,106,"Warm Salad with Artichoke Hearts, Roasted Peppers, Mozzarella",dinner,1.0,14.5,22.0,23.0,339.0,45.0,843.5,5.0,12.0,5.0,5.0,10 mins,5.0
307,107,Air Fryer Empanadas,lunch,1.0,11.0,5.0,22.0,183.0,16.0,196.0,1.0,2.5,10.0,16.0,30 mins,4.82
308,108,Greek Turkey Meatballs,appetizer,4.0,27.0,11.0,13.5,254.0,,,3.5,,10.0,15.0,25 mins,4.82
309,109,BBQ Chicken Salad,dinner,1.0,30.0,5.0,22.0,241.0,83.0,221.0,4.0,7.0,5.0,10.0,15 mins,4.89
310,110,Sloppy Joe Recipe,Dinner,1.0,13.7,3.7,9.9,122.0,31.5,470.0,2.1,5.0,10.0,20.0,30 mins,4.76
311,111,Tuna Croquettes (Baked or Air Fryer),canned tuna,2.0,22.5,3.5,21.5,215.0,69.0,426.5,1.5,1.5,10.0,40.0,1 hr,4.8
312,112,Escarole and Chickpea Soup with Garlic Toast,Dinner,1.0,10.5,4.0,38.0,222.0,,466.0,8.5,5.5,5.0,20.0,25 mins,5.0
313,113,Lobster Bisque,Dinner,1.0,14.0,6.0,17.0,203.0,65.0,852.0,2.5,7.0,15.0,50.0,1 hr 5 mins,4.75
314,114,Roasted Sweet Potato Black Bean Bowls,lunch,1.0,20.0,15.5,96.0,585.0,1.5,695.0,21.0,13.5,15.0,30.0,1 hr 15 mins,4.93
315,115,Mini Bell Pepper Loaded Turkey “Nachos”,lunch,7.0,18.0,11.0,6.5,187.0,62.0,418.0,1.0,0.5,15.0,25.0,40 mins,4.91
316,116,Air Fryer Buffalo Chicken Nuggets,lunch,,27.0,3.0,9.5,180.0,83.0,501.5,0.5,1.0,5.0,16.0,21 mins,4.95
317,117,Pepperoni Pizza Bites,appetizer,4.0,18.0,9.5,31.0,286.0,30.0,974.0,1.5,4.0,10.0,30.0,40 mins,4.81
318,118,Tuna Egg Salad,lunch,1.0,30.0,20.0,4.0,316.0,450.0,420.0,,,0.0,15.0,15 mins,4.95
319,119,Spaghetti Squash Crust Pizza,Dinner,2.0,28.0,17.0,18.0,303.0,139.0,855.0,5.5,5.5,30.0,30.0,1 hr,4.97
320,120,Taco Salad (Perfect for Meal Prep),dinner,1.0,28.5,17.5,13.0,313.0,92.5,917.5,4.0,5.5,10.0,20.0,30 mins,4.98
321,121,Sausage and Broccoli Rabe Egg Rolls (Air Fryer or Oven),appetizer,1.0,10.0,3.5,15.0,136.0,29.5,465.0,1.0,1.0,15.0,30.0,45 mins,4.5
322,122,Chilled Calamari Salad with Lemon and Parsley,appetizer,1.0,18.0,2.0,8.0,122.0,,66.0,0.9,1.2,10.0,5.0,15 mins,5.0
323,123,Leftover Turkey Harvest Cobb Salad,lunch,1.0,28.0,26.0,37.0,466.0,50.0,660.0,9.0,9.0,30.0,0.0,30 mins,5.0
324,124,Arugula Salmon Salad with Capers and Shaved Parmesan,dinner,1.0,32.5,16.0,2.0,288.0,86.0,288.5,0.5,1.2,5.0,10.0,15 mins,5.0
325,125,"Quick Beef Chili Recipe (Stove, Slow Cooker or Instant Pot)",Instant Pot,1.0,31.5,7.0,22.5,312.0,71.0,629.5,8.5,2.5,10.0,30.0,40 mins,4.9
326,126,Easy Black Bean Vegetarian Chili with Spiced Yogurt,Dinner,1.0,14.5,4.5,44.5,264.0,44.5,889.5,14.0,9.0,10.0,15.0,25 mins,4.93
327,127,Air Fryer Chicken Milanese with Mediterranean Salad,Dinner,2.0,63.0,21.0,28.5,562.0,278.0,908.5,3.5,4.5,15.0,15.0,30 mins,5.0
328,128,Chicken Cutlet Caprese Salad,dinner,1.0,45.5,24.0,14.5,462.0,231.5,755.5,2.0,1.5,15.0,20.0,35 mins,4.93
329,129,Cilantro Lime Chicken Breast (Grilled or Air Fryer),quinoa,1.0,38.5,5.5,0.5,217.0,124.0,360.0,0.5,0.5,5.0,15.0,1 hr 20 mins,4.74
330,130,Spicy Sriracha Tofu Rice Bowls (Air Fryer or Oven),cauliflower rice,1.0,29.0,20.0,38.0,453.0,,1109.0,6.5,6.5,15.0,15.0,30 mins,4.95
331,131,Sausage and Pepper Stromboli (Stuffed Sausage Bread),appetizer,1.0,12.5,5.5,43.5,272.0,20.5,671.0,1.5,1.0,10.0,50.0,2 hrs,5.0
332,132,Air Fryer Roasted Cauliflower Tacos,Dinner,3.0,8.5,21.5,22.5,284.0,4.5,837.0,6.5,11.5,,,,4.91
333,133,Coconut Red Curry Shrimp Skewers,dinner,2.0,36.0,5.0,13.0,252.0,250.0,848.0,3.0,4.0,35.0,15.0,50 mins,4.91
334,134,Air Fryer Burst Tomato Burrata Caprese Salad,lunch,1.0,15.0,18.0,30.0,307.0,40.0,505.5,3.5,7.0,5.0,10.0,15 mins,4.93
335,135,Cilantro Chicken Salad,canned tuna,1.0,23.0,6.0,3.0,160.5,61.5,151.5,0.5,1.0,10.0,0.0,15 mins,4.97
336,136,Foil Packet Cheesy Sausage and Peppers,dinner,1.0,18.5,11.5,12.5,223.0,67.5,886.5,3.0,5.5,5.0,40.0,45 mins,5.0
337,137,Grilled Shrimp Panzanella Skewers,dinner,2.0,28.0,3.0,18.0,216.0,188.0,376.0,2.5,7.0,20.0,10.0,30 mins,5.0
338,138,"Ground Turkey Skillet with Zucchini, Corn, Black Beans and Tomato",dinner,1.0,28.0,8.5,22.5,266.0,80.0,525.0,6.5,4.0,10.0,15.0,25 mins,4.88
339,139,Asparagus and Swiss Cheese Frittata,Asparagus,1.0,19.0,15.0,9.0,243.0,259.0,386.0,1.0,3.0,10.0,30.0,40 mins,4.96
340,140,Mayo-less Tuna Pasta Salad,lunch,1.0,24.5,10.5,23.0,271.5,37.0,463.0,3.5,1.5,10.0,0.0,10 mins,5.0
341,141,"Grilled Chicken, Strawberry, Avocado Salad with Citrus Dressing",lunch,1.0,30.0,26.0,14.0,399.0,83.0,164.0,5.5,6.0,10.0,15.0,55 mins,4.7
342,142,Shrimp Egg Rolls (Air Fryer or Baked),Appetizer,1.0,11.0,3.0,16.0,137.0,,414.0,1.0,1.5,10.0,15.0,25 mins,4.93
343,143,Lobster Roll Pasta Salad,dinner,2.0,23.5,5.5,34.0,282.0,137.0,766.0,2.0,1.5,10.0,15.0,25 mins,4.75
344,144,Air Fryer Chicken Sandwich with Sriracha Mayo,Dinner,1.0,35.0,8.0,31.0,334.0,100.0,796.0,6.0,7.0,15.0,18.0,6 hrs 33 mins,4.67
345,145,"Quinoa Salad with Kale, Cranberries and Mint",Quinoa,1.0,5.0,6.0,30.0,191.0,,,4.0,9.0,5.0,20.0,25 mins,5.0
346,146,Bisteces a la Mexicana (Mexican Style Beef Stew),Dinner,1.0,24.0,11.5,5.5,227.0,52.0,465.0,2.0,3.0,10.0,45.0,1 hr 55 mins,4.89
347,147,Cheeseburger Crunch Wrap,burger,1.0,33.0,18.5,22.0,354.0,103.5,1282.5,10.0,1.5,5.0,15.0,20 mins,4.83
348,148,Salmon Fried Rice,cauliflower rice,1.0,34.0,17.5,28.0,408.0,248.5,733.0,4.0,2.5,5.0,20.0,25 mins,5.0
349,149,Low-Yolk Egg Salad,Lunch,1.0,9.5,7.6,2.0,122.0,189.0,235.0,,0.5,5.0,20.0,25 mins,5.0
350,150,"Farro Salad with Feta, Cucumbers and Sun Dried Tomatoes",lunch,1.0,9.0,6.5,39.0,241.0,,177.5,6.0,2.0,10.0,20.0,30 mins,4.91
351,151,Easy (10-minute) Waffled Salmon Cakes,Dinner,2.0,22.0,6.5,5.5,169.0,125.5,536.5,0.5,0.5,5.0,10.0,15 mins,4.91
352,152,Coconut-Poached Chicken with Bok Choy and Mushrooms,quinoa,1.0,42.0,12.0,12.0,321.0,124.5,630.0,2.5,4.0,10.0,20.0,30 mins,4.56
353,153,Italian Ground Turkey Meatball Sheet Pan Dinner,Dinner,4.0,27.5,14.0,14.0,292.0,130.5,588.5,5.0,4.5,20.0,40.0,1 hr,4.83
354,154,Ahi Tuna Poke Stacks,Dinner,2.0,48.5,24.5,37.5,561.0,76.0,1620.5,7.5,5.0,20.0,0.0,20 mins,5.0
355,155,Navel Orange Salad with Avocado,Lunch,1.0,3.0,20.0,24.0,278.5,,48.5,7.0,15.0,15.0,0.0,15 mins,4.97
356,156,Asparagus and Feta Tartlet with Phyllo Crust,Asparagus,1.0,4.5,5.0,7.5,91.0,73.5,170.0,0.5,1.5,15.0,35.0,50 mins,4.62
357,157,Spring Green Pea Soup with Fresh Herbs,lunch,1.0,6.5,6.0,20.5,160.0,1.5,444.0,6.5,8.5,5.0,10.0,15 mins,4.91
358,158,One-Pot Chicken and Artichoke Cavatappi,dinner,2.0,39.0,5.0,56.5,428.0,83.0,1055.0,5.0,8.5,10.0,35.0,45 mins,4.65
359,159,Spanakopita Baked Eggs,appetizer,1.0,15.0,11.0,13.5,198.0,205.0,703.5,6.0,3.0,10.0,25.0,35 mins,4.75
360,160,Cacio e Pepe Frittata with Cauliflower and Lemony Yogurt,lunch,1.0,20.0,18.5,5.5,277.0,389.0,540.5,1.5,2.5,10.0,50.0,1 hr,5.0
361,161,Hearts of Palm Noodle Peanut Stir Fry,lunch,1.0,17.0,26.5,26.5,414.0,186.0,1110.0,11.5,7.5,5.0,10.0,15 mins,4.82
362,162,Pork Chops and Pears with Spicy Mustard Greens,dinner,1.0,39.0,17.5,12.5,372.0,105.0,171.0,4.0,9.0,10.0,15.0,25 mins,4.25
363,163,Air Fryer Lobster Jalapeño Empanadas,lunch,1.0,9.5,5.0,21.5,165.0,56.0,252.0,1.0,2.0,10.0,20.0,30 mins,
364,164,"Salmon Salad with Beets, Arugula, Pistachios and Pomegranates",lunch,1.0,33.5,26.5,18.0,437.0,85.0,727.5,4.5,12.0,15.0,15.0,30 mins,5.0
365,165,Beef Negimaki Stir Fry,dinner,1.0,28.5,7.5,14.0,251.0,78.0,1211.0,2.5,9.5,10.0,10.0,20 mins,4.74
366,166,Buffalo Chickpea Salad,lunch,1.0,8.5,5.0,27.0,182.0,0.5,821.0,6.0,2.5,20.0,10.0,30 mins,4.91
367,167,One-Pot Spaghetti Puttanesca,dinner,1.0,9.0,7.0,48.0,293.0,2.5,651.0,3.5,3.0,5.0,15.0,20 mins,4.84
368,168,Cottage Cheese Egg and Sausage Frittata,Cottage Cheese,1.0,21.5,15.0,2.0,233.0,386.0,723.0,0.5,1.0,5.0,25.0,30 mins,4.96
369,169,Peanut-Braised Chicken Breasts,quinoa,,45.0,15.0,14.0,365.0,124.5,490.0,4.5,6.5,10.0,40.0,50 mins,4.55
370,170,Instant Pot Braised Beef,Instant Pot,3.0,36.0,10.0,5.5,255.0,126.0,477.0,1.0,2.0,10.0,30.0,1 hr 40 mins,4.75
371,171,Shrimp Dumpling Lettuce Wraps or Rice Bowls,Lettuce Wraps,4.0,25.5,6.5,9.5,201.0,172.5,955.5,1.5,3.0,15.0,5.0,20 mins,4.76
372,172,"Baby Greens with Goat Cheese, Beets and Candied Pecans",Instant Pot,1.0,7.0,19.5,19.0,267.0,,211.0,2.0,14.0,10.0,0.0,10 mins,4.86
373,173,High Protein Bread (Oat Sandwich Rolls),cottage cheese,1.0,10.5,3.0,18.0,135.5,5.0,582.5,2.5,1.5,5.0,25.0,30 mins,4.41
374,174,Salmon Coconut Curry with Spinach and Chickpeas,dinner,1.0,41.0,20.0,23.5,453.0,94.0,275.0,5.0,1.5,5.0,20.0,25 mins,4.92
375,175,Spinach Stuffed Chicken Breast with Tomato and Feta,Dinner,1.0,44.5,22.0,7.0,407.0,148.0,830.0,1.5,3.5,15.0,20.0,35 mins,4.83
376,176,Sheet Pan Shrimp Oreganata,dinner,5.0,47.5,11.5,6.0,333.0,346.0,442.0,0.5,0.5,10.0,15.0,25 mins,4.95
377,177,Butternut Squash Lentil Soup,lunch,1.0,4.0,1.5,25.0,122.0,,309.5,7.0,8.0,15.0,50.0,1 hr 5 mins,4.94
378,178,Chicken Brown Rice Bowl (copycat Zinque’s Le Bowl),Rice Bowl,1.0,48.0,15.0,33.0,455.0,151.0,819.0,5.5,7.0,15.0,0.0,15 mins,4.93
379,179,Slow Cooker Butternut Squash Pear Soup,dinner,1.0,3.0,3.0,25.5,132.0,,275.0,6.0,10.0,5.0,,8 hrs 5 mins,4.76
380,180,Slow Cooker Chicken Enchilada Stuffed Sweet Potatoes,dinner,1.0,34.0,10.0,47.0,413.0,101.5,809.5,6.0,9.0,10.0,,6 hrs 10 mins,4.75
381,181,Pastrami Reuben Egg Rolls,appetizer,2.0,23.0,9.5,44.0,360.0,50.0,1297.0,3.0,3.0,15.0,10.0,25 mins,4.97
382,182,Detox Vegetable Soup,Dinner,1.0,15.0,12.5,34.0,293.0,,646.0,11.0,7.0,15.0,30.0,45 mins,4.74
383,183,Broccoli and Cheese Twice Baked Potatoes,,1.0,8.0,3.5,23.0,146.5,1.2,152.5,2.5,1.5,5.0,25.0,30 mins,4.77
384,184,Spicy Pork Brussels Bowls,Burger,1.0,35.0,10.0,15.5,280.5,252.5,474.0,6.0,3.5,5.0,25.0,30 mins,4.85
385,185,Ratatouille Baked Chicken,Dinner,2.0,63.5,20.0,28.5,543.0,280.0,340.5,9.0,10.0,10.0,,1 hr 10 mins,4.85
386,186,Greek Turkey Burgers,burger,1.0,29.0,14.5,2.5,255.0,111.0,360.0,0.5,1.0,15.0,15.0,30 mins,4.96
387,187,Crustless Quiche Lorraine,breakfast,1.0,16.0,14.0,2.5,205.0,214.5,350.0,,2.0,10.0,35.0,45 mins,4.9
388,188,Easy Crustless Spinach and Feta Pie,appetizer,1.0,9.0,5.0,12.0,126.0,69.0,433.0,2.5,1.5,10.0,30.0,40 mins,4.6
389,189,Air Fryer Fried Shrimp Sandwich with Tartar Sauce,lunch,1.0,34.5,9.35,33.5,352.0,228.0,873.0,7.0,6.5,10.0,20.0,30 mins,5.0
390,190,"Caramelized Onion, Red Pepper and Zucchini Frittata",breakfast,1.0,13.0,11.5,8.0,186.0,284.0,226.5,2.0,4.0,5.0,35.0,40 mins,4.84
391,191,Salmon Croquettes with Dill Sauce,appetizer,1.0,26.0,16.0,4.5,278.0,169.0,542.0,0.5,1.0,20.0,10.0,30 mins,3.96
392,192,Vegetarian Black Bean Tacos,dinner,2.0,13.0,15.4,42.0,367.0,10.0,669.0,12.0,2.0,15.0,10.0,25 mins,4.95
393,193,Zesty Lime Grilled Chicken with Pineapple Salsa,Dinner,6.0,41.0,18.5,16.5,395.0,124.5,225.0,2.0,8.0,30.0,15.0,45 mins,4.96
394,194,Jamaican Beef Patties,Appetizer,1.0,11.5,4.5,25.0,191.0,29.0,412.0,2.0,1.0,30.0,30.0,2 hrs,3.96
395,195,Omelet Tortilla Breakfast Wrap,Breakfast,1.0,28.0,17.0,23.0,315.0,377.0,1037.0,14.5,2.0,5.0,10.0,15 mins,4.93
396,196,Margherita Pizza,Appetizer,2.0,15.0,6.5,27.0,236.0,23.5,636.0,1.0,3.5,30.0,15.0,45 mins,4.84
397,197,Turkey Club,lunch,1.0,35.0,11.5,28.5,351.0,65.0,652.5,6.5,4.5,2.0,8.0,10 mins,5.0
398,198,Open-Faced Tuna Melt Sandwich Recipe,Lunch,1.0,28.5,6.5,14.5,231.0,,,3.5,,5.0,5.0,10 mins,4.75
399,199,Paprika Chicken Stew,Dinner,1.0,49.0,11.0,14.0,361.0,214.0,954.0,3.0,4.0,15.0,,1 hr 15 mins,4.58
400,0,Almond Cake,Dessert,1.0,7.0,11.0,17.0,179.0,47.0,39.0,3.0,13.0,20.0,40.0,1 hr,4.86
401,1,Lemon-Coconut Almond Cake,dessert,1.0,6.5,10.5,20.5,198.0,46.5,32.5,4.0,14.0,20.0,30.0,1 hr 5 mins,4.91
402,2,Lemon Poppy Seed Cupcakes,dessert,1.0,3.5,4.0,42.0,152.0,23.5,160.0,1.5,6.5,15.0,25.0,50 mins,
403,3,Chocolate Oat Flour Banana Bread,Breakfast,1.0,5.5,7.0,34.5,190.0,34.5,179.5,9.5,11.5,15.0,50.0,1 hr 20 mins,4.97
404,4,Cottage Cheese Cheesecake,cottage cheese,1.0,6.5,10.5,15.0,159.0,60.0,243.0,0.5,3.0,15.0,44.0,4 hrs 59 mins,4.88
405,5,Coconut Cookies,Dessert,2.0,1.5,2.5,19.0,188.0,,53.0,2.0,14.0,20.0,18.0,40 mins,4.86
406,6,Snowman Chocolate Bark,Dessert,1.0,2.0,8.0,18.0,118.0,,1.5,10.0,1.0,15.0,0.0,45 mins,
407,7,Coconut Macaroons,dessert,2.0,2.0,7.0,14.5,129.0,54.5,74.0,1.0,13.5,35.0,45.0,1 hr 20 mins,4.95
408,8,Chewy Chocolate Chip Cookies (Low-Fat),Dessert,2.0,2.0,6.0,20.0,133.0,15.5,45.0,3.0,8.0,10.0,10.0,20 mins,4.7
409,9,Oatmeal Chocolate Chip Cookies,breakfast,1.0,1.5,1.5,12.0,64.0,8.0,59.5,0.5,5.0,15.0,15.0,30 mins,4.84
410,10,Pumpkin Mug Cake,dessert,1.0,4.0,3.0,41.5,134.0,,21.5,3.5,1.5,5.0,2.0,7 mins,4.55
411,11,Pumpkin Chocolate Chip Cookies,Dessert,2.0,2.5,3.5,25.5,95.0,15.0,107.0,3.0,1.0,10.0,15.0,25 mins,4.84
412,12,Apple Turnover,dessert,1.0,1.5,1.0,24.0,111.0,,129.0,2.0,11.5,30.0,30.0,1 hr 10 mins,5.0
413,13,Apple Cobbler Recipe,dessert,1.0,1.5,4.0,44.5,215.0,5.5,71.0,4.0,32.0,20.0,50.0,1 hr 10 mins,5.0
414,14,Babka-Inspired Bagels,breakfast,1.0,5.0,2.0,30.0,158.0,47.0,473.0,1.0,5.0,30.0,28.0,1 hr 13 mins,4.89
415,15,Grilled Pineapple,dessert,2.0,0.6,1.0,24.0,102.0,,2.0,2.0,21.0,5.0,10.0,15 mins,4.97
416,16,Blueberry Galette,dessert,1.0,2.5,6.5,31.0,155.0,5.0,137.5,2.0,7.5,20.0,40.0,1 hr 15 mins,4.97
417,17,Carrot Cake Recipe with Cream Cheese Frosting,dessert,1.0,4.0,8.0,32.0,216.0,33.0,392.0,2.0,22.0,20.0,45.0,1 hr,4.85
418,18,Chocolate Brownie Date Balls,dessert,1.0,2.5,6.5,26.0,153.0,,1.5,4.0,20.5,15.0,0.0,15 mins,4.91
419,19,Healthy Chocolate Chip Oat Cookies,Dessert,2.0,4.0,10.0,20.0,174.0,15.5,50.0,4.5,6.5,10.0,10.0,20 mins,4.59
420,20,Apple and Grape Fall Fruit Salad,dessert,1.0,6.0,8.5,36.0,209.0,,16.0,3.0,19.0,15.0,,15 mins,5.0
421,21,Raspberry Coconut Chia Pudding Popsicles,dessert,1.0,1.8,5.0,6.8,74.0,,27.0,4.6,0.6,5.0,,6 hrs 5 mins,5.0
422,22,"Red, White and Blueberry Trifle",dessert,1.0,2.5,5.5,28.5,158.0,,143.5,2.0,15.5,15.0,0.0,1 hr 15 mins,4.96
423,23,Mango Coconut Chia Pudding,dessert,1.0,7.0,13.0,22.0,227.0,,66.0,11.5,10.5,5.0,0.0,5 hrs 5 mins,4.98
424,24,Instant Pot Baked Oatmeal Bars,Instant Pot,1.0,9.0,6.5,45.0,266.0,,61.0,8.0,11.0,10.0,50.0,1 hr,4.86
425,25,Blueberry Frozen Yogurt,dessert,1.0,2.5,2.5,36.0,76.0,8.5,29.0,1.5,9.5,20.0,,1 d 20 mins,4.89
426,26,Chocolate Frozen Yogurt in the Ninja™ CREAMi®,Dessert,1.0,4.0,3.5,20.5,88.0,11.0,54.0,1.0,8.5,15.0,0.0,1 d 15 mins,5.0
427,27,Lemon Cheesecake Yogurt Cups,dessert,1.0,3.5,4.5,12.0,108.0,6.5,108.0,1.0,9.0,10.0,25.0,35 mins,4.72
428,28,3-Ingredient Strawberries Romanoff,dessert,5.0,1.0,3.0,15.0,79.0,9.0,12.0,2.0,12.0,5.0,0.0,5 mins,4.93
429,29,Healthy 3-Ingredient Banana Oatmeal Cookies,breakfast,2.0,2.0,3.5,15.0,93.0,,0.5,2.0,4.5,10.0,15.0,25 mins,4.67
430,30,Red White and Blue Fruit Skewers with Cheesecake Yogurt Dip,dessert,1.0,3.0,2.5,18.5,105.0,1.5,147.5,2.0,7.0,20.0,0.0,20 mins,5.0
431,31,Triple Berry Crisp,breakfast,1.0,2.0,4.5,29.5,152.0,9.5,4.5,4.0,17.0,15.0,40.0,55 mins,5.0
432,32,Ambrosia Fruit Salad,dessert,1.0,1.5,7.0,26.0,163.0,,13.2,3.0,14.0,15.0,0.0,15 mins,5.0
433,33,Strawberries and Yogurt Whipped Cream,dessert,6.0,2.5,7.5,13.0,125.0,27.5,15.5,2.0,11.0,15.0,0.0,15 mins,5.0
434,34,Flaugnarde of Mixed Berries (Clafoutis),dessert,1.0,4.4,2.3,33.0,167.5,71.0,76.3,1.8,8.0,15.0,45.0,1 hr,4.8
435,35,“Fried” Oreos,Dessert,2.0,3.0,3.5,16.0,107.0,6.5,96.0,0.5,8.5,3.0,12.0,15 mins,5.0
436,36,3-Ingredient Baked Bananas,dessert,1.0,1.5,0.5,35.5,137.0,,2.0,3.0,23.0,5.0,15.0,20 mins,4.8
437,37,Fudgy Flourless Crinkle Brownie Cookies with Sea Salt,dessert,2.0,6.0,12.0,30.0,207.0,,189.0,8.0,16.5,15.0,15.0,2 hrs 30 mins,4.83
438,38,Pizzelle Cookies,Dessert,2.0,2.0,3.0,14.5,91.0,25.0,25.0,0.5,7.5,10.0,20.0,30 mins,5.0
439,39,Dark Chocolate Peanut Butter Bark,Dessert,1.0,3.0,12.0,17.0,144.0,17.0,19.0,8.0,0.5,10.0,5.0,15 mins,4.82
440,40,Apple Cranberry Crumble,dessert,3.0,2.0,5.5,44.5,211.0,,186.6,3.0,35.5,15.0,,1 hr 15 mins,4.97
441,41,Pumpkin Pistachio Energy Balls,dinner,1.0,3.0,5.0,24.0,138.0,,37.0,3.0,19.0,15.0,0.0,15 mins,4.77
442,42,Pumpkin Pie Dip,appetizer,1.0,2.0,4.0,21.0,105.0,1.0,10.0,1.0,17.0,15.0,0.0,15 mins,4.93
443,43,Skinny Pumpkin Snickerdoodles,Dessert,1.0,1.0,1.0,9.5,51.0,7.5,20.0,1.0,6.0,25.0,5.0,30 mins,4.44
444,44,Raspberry Yogurt Ice Pops,dessert,1.0,2.5,2.5,11.0,71.0,7.5,29.0,2.0,8.5,15.0,0.0,6 hrs 15 mins,4.67
445,45,Chocolate Zucchini Bread,breakfast,1.0,4.0,8.0,28.0,190.5,,147.0,2.5,14.5,20.0,55.0,1 hr 15 mins,4.64
446,46,Easy Blueberry Buttermilk Cake,dessert,1.0,3.1,2.9,33.0,168.0,17.5,191.8,1.2,17.1,20.0,30.0,50 mins,4.78
447,47,Flourless Chocolate Zucchini Brownies,Dessert,1.0,4.5,9.0,25.0,179.0,,139.0,2.5,20.0,15.0,30.0,1 hr 15 mins,4.79
448,48,Superfood Triple Berry Chia Pudding,breakfast,1.0,4.0,5.0,12.0,110.0,,64.0,7.5,3.0,20.0,0.0,5 hrs 20 mins,3.5
449,49,Skinny Hummingbird Cupcakes,dessert,1.0,3.0,6.5,31.0,198.0,16.5,284.0,1.5,22.0,20.0,23.0,45 mins,4.8
450,50,Skillet Mixed Berry Buttermilk Cobbler,dessert,1.0,2.0,4.0,28.0,151.0,5.5,100.5,4.5,16.5,10.0,10.0,1 hr 20 mins,4.8
451,51,Chocolate Pistachio Biscotti,Breakfast,1.0,2.5,4.5,15.0,103.0,20.5,43.5,1.0,6.5,15.0,25.0,45 mins,4.72
452,52,Chocolate Chip Clouds,Dessert,1.0,0.5,2.5,8.5,54.0,,9.5,1.0,7.0,15.0,40.0,55 mins,4.7
453,53,Strawberry Squares,dessert,1.0,2.0,4.5,22.0,138.0,45.0,39.0,,13.5,15.0,30.0,45 mins,4.91
454,54,Yogurt Panna Cotta with Macerated Berries,dessert,1.0,5.0,0.5,15.0,82.0,3.0,31.0,0.5,13.5,10.0,15.0,6 hrs 25 mins,5.0
455,55,Sweet Potato Pie,dessert,1.0,3.5,6.5,38.0,208.0,41.0,135.0,2.0,15.0,,,2 hrs,4.85
456,56,Cinnamon Apple Yogurt Bowls,breakfast,1.0,12.5,10.0,40.0,283.0,5.0,161.0,3.0,31.5,10.0,20.0,30 mins,4.85
457,57,Pumpkin Roll,Dessert,3.0,5.0,7.0,42.5,198.0,42.0,134.0,1.0,21.0,20.0,15.0,1 hr 35 mins,4.74
458,58,"Red, White and Blueberry Cheesecake Cupcakes",dessert,1.0,3.5,4.5,10.5,98.0,,29.5,0.5,7.5,10.0,,1 hr 35 mins,4.95
